{
  "$ref": "#/definitions/trainings",
  "definitions": {
    "trainings": {
      "type": "object",
      "properties": {
        "title": {
          "type": "string"
        },
        "topics": {
          "type": "array",
          "items": {
            "type": "string"
          }
        },
        "description": {
          "type": "string"
        },
        "duration": {
          "type": "string"
        },
        "format": {
          "type": "string",
          "enum": [
            "online",
            "offline",
            "both"
          ]
        },
        "audience": {
          "type": "array",
          "items": {
            "type": "string"
          }
        },
        "isPartner": {
          "type": "boolean",
          "default": false
        },
        "trainerName": {
          "type": "string"
        },
        "trainerRole": {
          "type": "string"
        },
        "trainerInitials": {
          "type": "string"
        },
        "contactEmail": {
          "type": "string"
        },
        "contactPhone": {
          "type": "string"
        },
        "links": {
          "type": "array",
          "items": {
            "type": "object",
            "properties": {
              "label": {
                "type": "string"
              },
              "url": {
                "type": "string"
              }
            },
            "required": [
              "label",
              "url"
            ],
            "additionalProperties": false
          }
        },
        "$schema": {
          "type": "string"
        }
      },
      "required": [
        "title",
        "topics",
        "description",
        "duration",
        "format",
        "audience",
        "trainerName",
        "trainerRole",
        "trainerInitials"
      ],
      "additionalProperties": false
    }
  },
  "$schema": "http://json-schema.org/draft-07/schema#"
}