{
  "title": "🌳 Как привлечь грант 10–11 июля | Бишкек",
  "topics": [
    "fundraising",
    "project"
  ],
  "description": "📅 10–11 июля | Бишкек\n\nГранты слышали все. Получают — единицы. Не потому что идей нет, а потому что большинство людей никогда не учили превращать идею в качественный проект и заявку.\n\n📊 За последние годы участники моих тренингов и консультаций привлекли финансирование на десятки миллионов сомов и сотни тысяч долларов. Некоторые примеры:\n— Чолпон (Нарын) — около 100 млн сомов\n— Наргис (Самарканд) — $150 000\n— Нурхан (Бишкек) — $120 000\n— Дина (Алматы) — $40 000\n— Эльмира (Алай) — $20 000\n— Пардакан (Жалал-Абад) — $10 000\n— Гульмира (Баткен) — более 4 млн сомов\n\nКонечно, гранты не выдаются автоматически после одного тренинга. Но за 2 дня вы получите пошаговую методологию разработки проектов, которую сможете использовать для подготовки заявок на гранты, конкурсы и программы финансирования.\n\n✅ На тренинге вы научитесь:\n— искать гранты и доноров\n— формулировать проблему, цели и результаты проекта\n— составлять план мероприятий\n— разрабатывать бюджет\n— готовить проектные заявки\n— использовать ИИ для подготовки проектов\n\n🎁 Каждый участник получит:\n— печатную книгу «Как привлечь денежный грант»\n— путеводитель по книге\n— список доноров и инвесторов\n— примеры проектов, получивших финансирование\n— бесплатную консультацию по своему проекту\n\n💰 Зафиксируйте стоимость 19 000 сом до 28 июня. После этого стоимость участия составит 28 000 сом.\n\n👨‍🏫 Тренер: Азат Исраилов. С 2012 года проводит тренинги по проектированию и привлечению финансирования для НКО, бизнеса, социальных предпринимателей и инициативных групп.\n\n📲 Регистрация: https://forms.gle/XwP6TynwPiTRLahg6\n❓ Вопросы и бронирование места: wa.me/996702271827\n\n📸 Прошедшие тренинги и отзывы участников:\nhttps://www.facebook.com/connect4kg/photos_albums или https://t.me/bilim4kg/4846",
  "duration": "2 дня / 16 часов",
  "format": "offline",
  "audience": [
    "НКО, бизнес, социальные предприниматели и инициативные группы"
  ],
  "isPartner": false,
  "trainerName": "Азат Исраилов",
  "trainerRole": "Тренер",
  "trainerInitials": "АИ",
  "contactEmail": "prof4dev@gmail.com",
  "contactPhone": "+996 702 27 18 27",
  "links": [
    {
      "label": "Регистрация",
      "url": "https://forms.gle/XwP6TynwPiTRLahg6"
    }
  ]
}
