{
  "title": "Фандрайзинг с нуля до гранта",
  "topics": ["fundraising"],
  "description": "Полная система привлечения финансирования: психология донора, поиск источников, написание заявок и выстраивание долгосрочных отношений с фондами.",
  "duration": "2 дня / 16 часов",
  "format": "both",
  "audience": ["НКО", "Руководители", "Специалисты по фандрайзингу", "Начинающие"],
  "isPartner": false,
  "trainerName": "Азат Исраилов",
  "trainerRole": "Консультант · 15+ лет в фандрайзинге",
  "trainerInitials": "АИ",
  "contactEmail": "azat@azatisrail.org",
  "contactPhone": "+996 702 27 18 27",
  "links": [
    { "label": "Подробнее о курсе", "url": "https://connect4funds.tilda.ws/" },
    { "label": "Telegram", "url": "https://t.me/azatisrailov" }
  ]
}
